{
    "_id": "TCGA:2018-04-05_KIRC",
    "_schema": "https://w3id.org/openebench/scientific-schemas/2.0/Challenge",
    "acronym": "KIRC",
    "benchmarking_event_id": "TCGA:2018-04-05",
    "challenge_contact_ids": [
        "orcid:0000-0003-4526-9727",
        "orcid:0000-0001-7900-4239",
        "orcid:0000-0003-1395-5378"
    ],
    "dates": {
        "creation": "2018-04-05T00:00:00Z",
        "modification": "2018-04-05T14:00:00Z",
        "challenge_start": "2018-04-05T05:00:00Z",
        "challenge_stop": "2018-04-05T02:00:00Z"
    },
    "is_automated": false,
    "metrics": [
        {
            "metrics_id": "TCGA:TPR",
            "tool_id": "TCGA:compute_TPR"
        },
        {
            "metrics_id": "TCGA:precision",
            "tool_id": "TCGA:compute_precision"
        }
    ],
    "representations": [
        {
            "representation_id": "TCGA:aggregation",
            "tool_id": "TCGA:aggregate_benchmark"
        }
    ],
    "name": "Cancer Driver Genes Prediction Benchmark in Kidney Renal Clear Cell Carcinoma",
    "references": [
        "doi:10.1016/j.cell.2018.02.060"
    ],
    "links": [
        {
            "label": "MainSite",
            "uri": "https://www.cancer.gov/about-nci/organization/ccg/research/structural-genomics/tcga/studied-cancers/renal-cell-clear-cell"
        }
    ],
    "participation_model": "anonymous"
}
