{
    "_id": "QfO:2011-07-07_STD_Fungi",
    "_schema": "https://w3id.org/openebench/scientific-schemas/2.0/Challenge",
    "acronym": "STD_Fungi",
    "benchmarking_event_id": "OEBE0020000000",
    "challenge_contact_ids": [
        "orcid:0000-0002-2170-853X",
        "orcid:0000-0002-9074-3507",
        "orcid:0000-0003-0019-1735",
        "orcid:0000-0002-9015-5588"
    ],
    "dates": {
        "challenge_start": "2011-07-07T00:00:00Z",
        "challenge_stop": "2011-07-07T00:00:00Z",
        "creation": "2011-07-07T00:00:00Z",
        "modification": "2011-07-07T00:00:00Z"
    },
    "is_automated": true,
    "participation_model": "public",
    "metrics": [
        {
            "metrics_id": "QfO:STD_comp_trees",
            "tool_id": "QfO:metrics_computator"
        },
        {
            "metrics_id": "QfO:STD_num_orthologs",
            "tool_id": "QfO:metrics_computator"
        },
        {
            "metrics_id": "QfO:STD_RF_distance",
            "tool_id": "QfO:metrics_computator"
        },
        {
            "metrics_id": "QfO:STD_incorrect_trees",
            "tool_id": "QfO:metrics_computator"
        }
    ],
    "representations": [
        {
            "representation_id": "QfO:aggregation",
            "tool_id": "QfO:aggregate_benchmark"
        }
    ],
    "name": "Species Tree Discordance in Fungi benchmark",
    "references": [
        "doi:10.1093/bib/bbr034"
    ],
    "links": [
        {
            "label": "MainSite",
            "uri": "https://orthology.benchmarkservice.org/cgi-bin/gateway.pl?f=CheckResults&p1=72d29d4aebb02e0d396fcad2"
        }
    ]
}